Category,Indicator,subTitle,dataType,dataSource,dataSourceYear,chartComment,description,2000,2001,2002,2003,2004,2005,2006,2007,2008,2009,2010,2011,2012,2013,2014
Social determinants of health,"Unemployment, at 16 years of age",,Percentage,Bureau of Labor Statistics,2000-2014,Citywide Over Time and Top 10 Cities unemployment estimates use more recent data from the Bureau of Labor Statistics 2014. This source was not available for estimates by Planning District and Racial Disparity. Planning District and Racial Disparity estimates were based on 2009-2013 American Community Survey data.,"Percentage of population, 16 years or older, who are unemployed but seeking work.",0.055,0.061,0.074,0.075,0.073,0.067,0.062,0.061,0.071,0.097,0.106,0.107,0.109,0.104,0.08
Child health,"Child mortality rate per 100,000, <18 years of age",,Rate,"Vital Statistics for Philadelphia, Pennsylvania Department of Health",2000-2012,,"Age-adjusted mortality rate per 100,000 children under 18.",86,92,89,84.4,89.2,91.1,87.5,95,82.7,77.2,78.8,65.5,78.6,,
Access to care,"Ambulatory care sensitive hospitalization rate per 100,000",,Rate,Pennsylvania Health Care Cost Containment Council,2000-2012,,"Age-adjusted rate per 100,000 persons for conditions where appropriate ambulatory care prevents or reduces the need for admission to the hospital, for population under 75 years of age. ",1572.1,1556.1,1580.6,1680.3,1592.2,1569.2,1608.9,1583.6,1541.7,1476.9,1348,1315.9,1258,,
Access to care,"Children with dental visit in past year, 3-17 years of age",,Percentage,Public Health Management Corporation (PHMC) Household Health Survey,2000-2014/15,,"Percentage of children, age 3-17 years, for whom adult proxy reported dental visit in past 12 months.",0.716,,0.785,,0.788,,0.818,,0.837,,0.874,,0.82,,0.884
Cancer screening and prevention,"Cancer mortality per 100,000",,Rate,"Vital Statistics for Philadelphia, Pennsylvania Department of Health",2000-2012,,"Age-adjusted rate of cancer deaths per 100,000 persons.",249.7,250.3,240.3,243.3,231.3,222.8,228.1,223.1,211.8,219.1,203.3,214.7,206.8,,
Environmental health,Days with good air quality,,Count,"Air Management Services, Philadelphia Department of Public Health",2000-2013,,"Number of days of the year with Air Quality Index (AQI) levels of 0-50, wherein air quality is considered satisfactory and air pollution poses little or no risk. AQI is a scale from 0 to 500, reflecting measures of ground-level ozone, particulate matter, carbon monoxide, sulfur dioxide, and nitrogen dioxide pose little or no risk. The reporting is based on 2013 Environmental Protection Agency standards.",142,108,127,146,138,150,154,140,128,185,175,159,147,173,
Violence,"Homicide mortality rate per 100,000",,Rate,"Vital Statistics for Philadelphia, Pennsylvania Department of Health",2000-2012,,"Age-adjusted rate of homicide deaths per 100,000 persons.",20.6,19.9,18.5,21.7,20.8,23,24.4,23.4,19.8,18,18.6,19.8,19.7,,
Mental health and substance abuse,"Suicide mortality rate per 100,000",,Rate,"Vital Statistics for Philadelphia, Pennsylvania Department of Health",2000-2012,,"Age-adjusted rate of deaths by intentional self-harm per 100,000 persons.",10.6,9.2,10.5,10.9,10.1,10.8,9,8.7,11.7,10,9.5,10.1,10.7,,